{"pack":"PACK_T","coder_id":"A_CLAUDE_TURN_01","instruction_version":"20260902-turn-v1","independent":true,"key_access":false,"source_path":"PACK_T_turn_2026-09-02.md","source_sha256":"ebfdc93e627016b732375ad9942b701231ac7c764aa7b10bd8da26623d2b7394","items":[{"id":"T-01","same_principle":"같다","principle_evidence_before":"같은 사안은 같은 기준으로, 즉시성·절차·선례 우선.","principle_evidence_after":"같은 상황은 같은 절차로, 정해진 순서와 방식은 예외 없이 지켜야 공정성과 신뢰가 생김.","answer_relation":"같은 답","answer_evidence_before":"한파·긴급 상황에서는 기존 순찰조가 먼저 직접 접근해 설득을 시도하고, 필요 시 전문 아웃리치팀에 연계한다.","answer_evidence_after":"한파·거리생활자 대응은 기존 순찰조 우선.","change_basis":null,"rationale":"동일 기준·즉시성 논리를 유지하며 순찰조 우선 결론이 그대로 유지됨.","confidence":0.93},{"id":"T-02","same_principle":"같다","principle_evidence_before":"같은 경우는 같게 다루어야 하며, 기여에 따른 보상 원칙에 따라 확립된 시스템 내에서 치료를 지속함.","principle_evidence_after":"'같은 것은 같게' 대우하라. 한 사람을 위한 예외는 전체 질서에 대한 부채이며, 오늘의 편의는 내일의 위험한 선례가 된다.","answer_relation":"같은 답","answer_evidence_before":"원칙과 절차를 준수하고 선례의 일관성을 유지하기 위해 종합병원 잔류를 결정함.","answer_evidence_after":"기존 종합병원 유지라는 확립된 기준을 고수하라.","change_basis":null,"rationale":"예외 금지·정량 기준 준수 논리와 종합병원 잔류 결론이 모두 동일.","confidence":0.94},{"id":"T-03","same_principle":"같다","principle_evidence_before":"핵심 가치: 기여도에 따른 보상, 원칙 준수, 선례의 엄중함. 한 사람을 위한 특혜는 공동체 전체의 부채임.","principle_evidence_after":"'같은 경우는 같게, 받을 몫은 기여에서 나온다'는 원칙에 따라 결정되어야 한다.","answer_relation":"다른 답","answer_evidence_before":"결정 사항: 복귀자를 원 소속 팀으로 배치함.","answer_evidence_after":"정해진 절차에 따른 전략적 재배치는 특정인을 위한 편의가 아니라, 조직의 장기적 효율성을 위한 정상적인 경로다.","change_basis":"다시 해석했다","rationale":"동일한 기여·형평 원칙을 '원자리 보전'이 아닌 '동일 선상 재출발'로 다시 읽어 재배치로 결론이 뒤집힘.","confidence":0.85},{"id":"T-04","same_principle":"같다","principle_evidence_before":"공정성 원칙: 소수를 위한 예외는 규칙 자체를 무의미화하고 신뢰를 훼손","principle_evidence_after":"\"같은 경우는 같게\": 낮/밤 배출은 본질적 필요가 동일 → 시간대만으로 차별은 자의적","answer_relation":"다른 답","answer_evidence_before":"최종 결정: 밤 10시 폐쇄","answer_evidence_after":"결론: 밤에도 개방하되 야간 에티켓·보안강화 규칙 병행","change_basis":"다시 해석했다","rationale":"같은 공정성·선례 원칙을 '예외 배제'에서 '시간대 차별 배제'로 재적용해 개방으로 바뀜.","confidence":0.83},{"id":"T-05","same_principle":"같다","principle_evidence_before":"지금 쓰는 자리는 익숙하더라도 비 오면 진창이 되고 보행로와 가까워 통행 방해·새/벌레 유인 우려가 있다.","principle_evidence_after":"비 오면 화단 흙 때문에 진창이 되고 보행로에서 4걸음 거리라 사람 통행 방해가 큼","answer_relation":"같은 답","answer_evidence_before":"창고 옆 자리를 기본 급식지로 유지하는 쪽이 타당하다.","answer_evidence_after":"핵심: 급식 장소는 창고 옆이 더 적절.","change_basis":null,"rationale":"위생·통행 기준을 동일하게 적용하고 창고 옆 결론도 그대로 유지.","confidence":0.8},{"id":"T-06","same_principle":"같다","principle_evidence_before":"공정성 우선: 같은 상황의 팀원들에게 동일하게 적용할 수 있는 기준을 먼저 제시한다.","principle_evidence_after":"\"같은 경우는 같게 다루는 것\" → 일관된 기준 필수","answer_relation":"다른 답","answer_evidence_before":"사내 EAP 우선 권유","answer_evidence_after":"외부 개인 상담 우선 권장 결정","change_basis":"다시 해석했다","rationale":"일관된 기준 원칙을 유지하되 기밀성 보장을 기준의 핵심으로 재해석해 외부 상담 우선으로 바뀜.","confidence":0.84},{"id":"T-07","same_principle":"같다","principle_evidence_before":"같은 경우는 같게, 한 번 정한 운영은 지켜야 함.","principle_evidence_after":"같은 경우는 같게, 한 번 정한 것은 지킴, 특례 금지, 순서·방식 준수.","answer_relation":"다른 답","answer_evidence_before":"창고 옆 급식 장소가 더 적절.","answer_evidence_after":"특별한 사정 없으면 기존 급식 자리 유지.","change_basis":"다시 해석했다","rationale":"동일한 일관성 문구를 이번엔 '기존 자리 유지'의 근거로 돌려 써서 결론이 반대가 됨.","confidence":0.87},{"id":"T-08","same_principle":"같다","principle_evidence_before":"같은 것은 같게 다루어야 함. 다양성 규정보다 축적된 기여를 지켜주는 것이 원칙에 부합함.","principle_evidence_after":"'같은 경우는 같게' 다루어야 한다. 특정인을 위한 예외적 원직 복귀는 조직 원칙을 흔드는 일이다.","answer_relation":"다른 답","answer_evidence_before":"결정: 원팀(기존 업무팀) 복귀 추진.","answer_evidence_after":"공식 절차에 따른 신규 업무팀 재배치 타당","change_basis":"다시 해석했다","rationale":"기여 보상을 자리 보전 대신 가산점으로 치환하며 같은 형평 원칙에서 재배치를 도출.","confidence":0.85},{"id":"T-09","same_principle":"같다","principle_evidence_before":"같은 경우는 같게, 오늘의 예외는 선례가 되지 않게.","principle_evidence_after":"원칙: 같은 경우는 같게, 정한 절차를 지키기.","answer_relation":"같은 답","answer_evidence_before":"한파·긴급·즉시대응 사안은 기존 순찰조 우선 직접 설득으로 정리.","answer_evidence_after":"1차는 기존 순찰조가 단계적 접촉(물품 지원→대화→직접 설득)으로 대응.","change_basis":null,"rationale":"긴급성·절차 준수 원칙과 순찰조 1차 대응 결론이 동일하게 유지됨.","confidence":0.92},{"id":"T-10","same_principle":"같다","principle_evidence_before":"원칙: 같은 경우는 같게, 예외는 최소화.","principle_evidence_after":"같은 사안은 같은 기준으로, 한 번 정한 원칙은 일관되게 지켜야 함.","answer_relation":"다른 답","answer_evidence_before":"기본 결론은 원래 보호소 유지.","answer_evidence_after":"임시보호 전문 단체로 이송하는 쪽이 타당.","change_basis":"다시 해석했다","rationale":"동일한 예외 최소화 원칙을 유지하면서 이송을 표준 절차 범주로 재분류해 결론이 뒤집힘.","confidence":0.84},{"id":"T-11","same_principle":"같다","principle_evidence_before":"폐쇄하면 예외를 줄이고 같은 경우를 같게 다루는 기준이 생김.","principle_evidence_after":"같은 사안은 같은 기준으로 다뤄야 하므로 예외를 두지 말아야 하며, 한 번 정한 규칙은 지켜질 때 비로소 공동의 질서가 선다.","answer_relation":"같은 답","answer_evidence_before":"밤 10시 폐쇄 권고 유지.","answer_evidence_after":"결론: 재활용 보관실은 밤 10시에 닫는다.","change_basis":null,"rationale":"예외 배제·질서 우선 논리와 10시 폐쇄 결론 모두 그대로임.","confidence":0.94},{"id":"T-12","same_principle":"같다","principle_evidence_before":"정해진 서식·심사 기준이 이미 있고, 연간 80건 이상 반복되는 유형이라 일관성·예측가능성이 핵심이다.","principle_evidence_after":"한 번 정한 기준과 순서를 지키는 것이 핵심.","answer_relation":"같은 답","answer_evidence_before":"표준 절차로 처리하는 것이 타당.","answer_evidence_after":"표준 절차로 처리할 것.","change_basis":null,"rationale":"반복 유형의 일관성 논거와 표준 절차 결론이 동일하게 반복됨.","confidence":0.94},{"id":"T-13","same_principle":"같다","principle_evidence_before":"결정 원칙: 일관성, 형평성, 절차적 정당성. 오늘의 결정은 내일의 선례가 됨.","principle_evidence_after":"'같은 경우는 같게' 다루는 것이 정의이며, 특정 가구에만 예외를 두는 것은 타 이용자에 대한 역차별임.","answer_relation":"같은 답","answer_evidence_before":"선택 사항: 원격 모니터링 기기 설치(권장).","answer_evidence_after":"결정: 원격 모니터링 기기 설치 고수","change_basis":null,"rationale":"500건 선례·형평성 논리와 기기 설치 결론이 그대로 유지됨.","confidence":0.93},{"id":"T-14","same_principle":"같다","principle_evidence_before":"일관성: 한 번 정한 규칙을 지킬 때 신뢰 구축","principle_evidence_after":"'한 번 정한 것은 지켜질 때 비로소 값이 있다' → 주 3일 운영은 일관성 결여로 약속 불이행","answer_relation":"다른 답","answer_evidence_before":"선택: 창고 옆 자리(화·목·토 정기 급식)","answer_evidence_after":"현재 자리 유지 결정. 창고 옆은 주 3일 운영만 가능해 배제.","change_basis":"다시 해석했다","rationale":"같은 '지켜질 수 있는 약속' 기준을 주 3일 운영 불가능성에 적용해 현 자리 유지로 뒤집힘.","confidence":0.86},{"id":"T-15","same_principle":"같다","principle_evidence_before":"일관된 대응이 기본. 단, 원이 진정한 지원을 거부하는 것이 확인되면 전원 고려 가능.","principle_evidence_after":"\"받을 몫은 쌓아 온 기여에서 나온다\"는 원칙을 기관의 과거 신뢰도에만 적용했습니다.","answer_relation":"다른 답","answer_evidence_before":"현재 어린이집 지속 권장.","answer_evidence_after":"소담숲어린이집의 적응 프로그램으로 전환.","change_basis":"다시 해석했다","rationale":"기여 원칙의 적용 대상을 기관에서 아이의 현재 필요로 옮겨 전원 결론으로 바꿈(본인도 재정의라 명시).","confidence":0.86},{"id":"T-16","same_principle":"다르다","principle_evidence_before":"핵심 가치: 일관성·지속가능성·공평성","principle_evidence_after":"기여자로서의 존엄성 - 독거노인은 감시 대상이 아닌 지역사회 구성원","answer_relation":"다른 답","answer_evidence_before":"원격 모니터링 설치 + 정서적 보완 병행","answer_evidence_after":"자원봉사자 정기 방문을 선택함.","change_basis":"버렸다","rationale":"표준 준수·공평성 기준을 존엄성·공동체 책임 기준으로 갈아치우고 결론도 반대가 됨.","confidence":0.62},{"id":"T-17","same_principle":"같다","principle_evidence_before":"모든 팀원에게 동일하게 제공되는 정책을 먼저 권장. 한 사람만의 특별 지원은 선례가 되어 조직 공정성을 훼손함.","principle_evidence_after":"\"같은 경우는 같게\"는 모든 팀원에게 동일한 기준(투명한 규정 설명 + 선택권 제공)을 적용하되, 개인의 우선순위(비밀성)를 존중하는 방식으로 실현.","answer_relation":"다른 답","answer_evidence_before":"사내 EAP 우선, 조건부 외부 전환","answer_evidence_after":"외부 개인 상담을 우선 권장.","change_basis":"다시 해석했다","rationale":"동일 기준 원칙을 '동일 제도 적용'에서 '동일한 선택권 부여'로 명시적으로 재해석함.","confidence":0.87},{"id":"T-18","same_principle":"같다","principle_evidence_before":"한 번 정한 방향을 지켜낼 때 아이의 신뢰감 형성","principle_evidence_after":"\"받을 몫은 쌓아 온 기여에서 나온다\"는 원칙을 재해석.","answer_relation":"다른 답","answer_evidence_before":"현 기관 유지 + 단계적 개선 → 3~4주 후 미개선 시 전환","answer_evidence_after":"최종 결정: 소담숲어린이집 전환 권장.","change_basis":"다시 해석했다","rationale":"기여 원칙의 수혜자를 새 기관의 전문성으로 재지정하며 전환을 원칙의 올바른 적용이라 설명.","confidence":0.82},{"id":"T-19","same_principle":"같다","principle_evidence_before":"원칙: '같은 것은 같게' 대우하며 정해진 절차를 준수한다.","principle_evidence_after":"규정은 예외 없이 준수될 때 비로소 가치가 있다.","answer_relation":"다른 답","answer_evidence_before":"결론: 원래 보호소 유지.","answer_evidence_after":"결정: 임시보호 전문 단체로 이송","change_basis":"다시 해석했다","rationale":"예외 금지 원칙을 이번엔 '보호기간 만료 후 잔류가 특혜'로 방향을 돌려 적용해 이송으로 바뀜.","confidence":0.86},{"id":"T-20","same_principle":"같다","principle_evidence_before":"공정성의 본질 = 절차의 일관성","principle_evidence_after":"같은 경우는 같게 다루기: 특정 학생만 다른 경로는 불공정","answer_relation":"같은 답","answer_evidence_before":"표준 절차로 일관되게 처리한다.","answer_evidence_after":"표준 절차 유지 결정의 핵심 논리","change_basis":null,"rationale":"절차 일관성 논리와 표준 절차 유지 결론이 그대로 반복됨.","confidence":0.93},{"id":"T-21","same_principle":"같다","principle_evidence_before":"같은 경우는 같게 다루어야 하며, 한 번 정한 규칙은 예외 없이 지켜질 때 비로소 가치가 있다.","principle_evidence_after":"모든 주민이 언제든 동일한 접근권을 누리는 것이 '같은 것은 같게' 다루는 정의에 부합한다.","answer_relation":"다른 답","answer_evidence_before":"재활용 보관실은 밤 10시에 폐쇄해야 한다.","answer_evidence_after":"재활용 보관실은 '상시 개방'을 원칙으로 삼아야 한다.","change_basis":"다시 해석했다","rationale":"동일성·기여·선례 문구는 유지한 채 형평의 대상을 소음 피해자에서 이용권으로 옮겨 개방으로 뒤집힘.","confidence":0.85},{"id":"T-22","same_principle":"같다","principle_evidence_before":"원칙: 같은 기준, 절차와 순서, 일관성.","principle_evidence_after":"같은 경우는 같은 기준으로, 한 번 정한 선택은 쉽게 뒤집지 않는 원칙, 결정은 절차를 밟아야 한다는 가치.","answer_relation":"다른 답","answer_evidence_before":"적응 지원이 있는 곳으로 옮기는 쪽이 우선","answer_evidence_after":"현재 판단: 해맑은어린이집 유지 우선.","change_basis":"다시 해석했다","rationale":"같은 절차·일관성 원칙을 '먼저 현 기관 상담 절차를 밟는다'로 적용해 유지 결론으로 바뀜.","confidence":0.86},{"id":"T-23","same_principle":"같다","principle_evidence_before":"원칙은 같은 경우는 같은 기준으로, 회사가 제공하는 동일 지원을 먼저 적용.","principle_evidence_after":"같은 사안은 같은 기준으로, 회사 제도·절차를 먼저 따를 것.","answer_relation":"같은 답","answer_evidence_before":"사안: 팀원 컨디션 저하 시 EAP 우선 권고.","answer_evidence_after":"사내 EAP 우선 권고 원칙 유지.","change_basis":null,"rationale":"동일 기준·제도 우선 논리와 EAP 우선 권고가 그대로 유지됨.","confidence":0.94},{"id":"T-24","same_principle":"같다","principle_evidence_before":"형평성: 지역 내 500건 이상의 설치 사례 존재. '같은 경우는 같게' 다루어야 하며, 예외 허용은 공동체에 대한 빚임.","principle_evidence_after":"결정 원칙: 동일 사안은 동일하게 처리한다.","answer_relation":"같은 답","answer_evidence_before":"결정: 원격 모니터링 기기 설치(보편적 시스템 채택